{
  "first_name": "Fehri",
  "last_name": "Haloui",
  "email": "Fehrihaloui2@gmail.com",
  "phone": "",
  "location": {
    "city": "Tunisia",
    "country": "Tunisia"
  },
  "technical_skills": [],
  "professional_experience": [
    {
      "position": "Chargé de Comptabilité Clients Recruiter or TT Update H/F (1578067)",
      "company": "",
      "duration": ""
    },
    {
      "position": "EY Client Name per Consultant junior Global Independence GC Look Compliance & Reporting H/F up",
      "company": "EY",
      "start_date": "02/08/2025",
      "end_date": "",
      "duration": ""
    },
    {
      "position": "Gestionnaire administratif et GCSP Response No Selection financier - H/F (1400539)",
      "company": "Banque ZITOUNA",
      "start_date": "01/29/2025",
      "end_date": "",
      "duration": ""
    },
    {
      "position": "Chargé(e) de rapprochement Application Information bancaire H/F (1487391)",
      "company": "",
      "start_date": "01/29/2025",
      "end_date": ""
    }
  ],
  "education": [
    {
      "degree": "Bachelor's Degree in Accounting and Finance",
      "institution": "Institut Supérieur des Etudes Technologiques Nabeul, Tunisie",
      "year_completed": ""
    }
  ],
  "languages": [],
  "projects": [],
  "certifications": [],
  "publications": [],
  "references": [],
  "cv_language": "en",
  "raw_text": "There are no items in this section.",
  "cv_text": "1 of 3\nEXTERNAL CANDIDATE\nHaloui, Fehri\n27845511 Fehrihaloui2@gmail.com\nApplication Comments\nCandidate Status New Application@ There are no items in this section.\nAttachments Documents 0 attached Jobs Applied\nApplication Id 24805416\nChargé de Comptabilité Clients\nRecruiter or TT Update H/F (1578067)\nRecruiter Review No Selection New Application@\n02/08/2025\nAttachments Documents 0 attached\nEY Client Name per Consultant junior Global\nIndependence GC Look Compliance & Reporting H/F\nup\n(1572815)\nCurrent Restrictions No Selection\nNew Application@\nGCSP Name / Audit 01/29/2025\nPartner Name (if\nChannel 1) Gestionnaire administratif et\nGCSP Response No Selection financier - H/F (1400539)\nSourcer Information Does Not Meet the Required\nCriteria for the Position\nSourced by\n01/29/2025\nSourcing Team Source No Selection\nChargé(e) de rapprochement\nApplication Information\nbancaire H/F (1487391)\nYour privacy is important to us. Please do not enter any Requisition Cancelled@\nunnecessary personal information or any sensitive personal data 01/29/2025\n(including government identifiers such as tax file numbers or\nsocial security numbers), or anything that would violate\nAssessments\nprofessional confidentiality rules or that would be considered\nThere are no items in this section.\nirrelevant.\nCorrespondence\nCountry/Region TUNISIA\n01/29/2025 SuccessFactors System Email\nShould you need\nThank you for applying to EY -\naccommodations in your\n1572815 Consultant ...\nrecruiting process,\nplease indicate how EY\ncan accommodate you. Offer Letter\nAdditional Documents Documents 0 attached There are no items in this section.\nApplication Status Audit Trail\nScreening Details\n01/29/2025 SuccessFactors System\nThere are no items in this section. New Application@\nWork Experience\nTags\n*Company Name CBA Expert Tunisie There are no items in this section.\n*Title Comptable Français\nPresent Employer Yes More Information\n*From Date 09/01/2022 Prefix\nPreferred First Name\nEnd Date MM/DD/YYYY\nSecond Last Name\nType of Business No Selection\nCandidate Full Name\nCountry No Selection\nAddress Line 1\nAddress Line 2\n*Company Name TUNISTAR Hammamet,Tunisie\nCity\n2 of 3\n*Title Assistant au contrôle de gestion\n*Country/Region TUNISIA\nPresent Employer No\nState/Province\n*From Date 03/01/2021\nPostal Code\nEnd Date 07/31/2021 Country Code\nType of Business No Selection Secondary/Personal\nCountry No Selection Email\nUsername\nAre you an EY Alumni?\n*Company Name Fethi NAANAA Hammamet Hammamet,Tunisie\nIf Yes Which Country\n*Title Assistant comptable\nWere You Last\nPresent Employer No Assigned to?\n*From Date 01/01/2020 Target Country/Region\nEnd Date 02/29/2020 Target Location\nType of Business No Selection Profile URL\nCountry No Selection Client Type\nEC - Employee Id\nPost Conversion\n*Company Name Banque ZITOUNA Hammamet,Tunisie External Email\n*Title Guichetier de banque\nPresent Employer No\n*From Date 01/01/2018\nEnd Date 02/28/2018\nType of Business No Selection\nCountry No Selection\nIf you are applying for jobs in the United States, do not complete the start and end date fields.\nEducation\n*School Institut Supérieur des Etudes Technologiques Nabeul,\nTunisie\n*Degree Bachelor's Degree (±16 years)\n*Major Accounting and Finance\nFrom Date 09/01/2018\nEnd Date 01/31/2022\nLanguage Skills\nThere are no items in this section.\nGeographic Mobility\nThere are no items in this section.\n3 of 3"
}